{"golden_envelope_schema_version":1,"expectation_id":"row-hashes","kind":"structured","contract_binding":{"owner":"canonical-row-hash-capability","contract_id":"gateway-vnext.canonical-row-hash-compute-boundary","semantic_version":"1.0.0"},"payload_descriptor":{"media_type":"application/json","schema_id":"gateway-vnext.canonical-table-result.v1","schema_version":1,"canonical_encoding_version":1,"comparison_mode":"exact-canonical"},"content_digest":"sha256:9ca39767f4f7e685da2d91699681b988e69fcc6ee9ce4d90e1634b487f81f420","payload":{"storage":"inline","value":{"arrow_mapping_schema_version":1,"canonical_encoding_version":1,"contract_binding":{"contract_id":"gateway-vnext.canonical-row-hash-compute-boundary","semantic_version":"1.0.0"},"diagnostics":[],"raw_content_digest":"sha256:daea1097910086ec87ab148789be747ccbb34a958548456adefe1e5d7e7fa158","result_schema_version":1,"row_count":"3","table_schema_digest":"sha256:0d6c0579ef52cbdd310be9c95879d3d9dfc2d867271fd387fa9e66a0d34cc28e"}}}